{"$schema":"https://json-schema.org/draft/2020-12/schema","$id":"https://latent.dev/schemas/v1/package-source.schema.json","title":"LSF v1 explicit package file-selection recipe","type":"object","additionalProperties":false,"required":["formatVersion","kind","name","version","entrypoint","annotations","layers"],"properties":{"formatVersion":{"const":1},"kind":{"enum":["capsule","browser-assets","ssr-package"]},"name":{"type":"string","minLength":1,"maxLength":128,"pattern":"^[a-z0-9](?:[a-z0-9._-]*[a-z0-9])?(?![\\s\\S])"},"version":{"type":"string","minLength":5,"maxLength":128,"pattern":"^(0|[1-9][0-9]*)\\.(0|[1-9][0-9]*)\\.(0|[1-9][0-9]*)(?:-((?:0|[1-9][0-9]*|[0-9]*[A-Za-z-][0-9A-Za-z-]*)(?:\\.(?:0|[1-9][0-9]*|[0-9]*[A-Za-z-][0-9A-Za-z-]*))*))?(?:\\+([0-9A-Za-z-]+(?:\\.[0-9A-Za-z-]+)*))?(?![\\s\\S])"},"entrypoint":{"$ref":"#/$defs/path"},"annotations":{"$ref":"#/$defs/annotations"},"layers":{"type":"array","minItems":1,"maxItems":255,"items":{"$ref":"#/$defs/layer"}}},"$defs":{"path":{"type":"string","minLength":1,"maxLength":240,"pattern":"^(?!\\.{1,2}(?:/|$))(?!(?:[Cc][Oo][Nn]|[Pp][Rr][Nn]|[Aa][Uu][Xx]|[Nn][Uu][Ll]|[Cc][Oo][Mm][1-9]|[Ll][Pp][Tt][1-9])(?:\\.|/|$))(?![A-Za-z0-9_.-]*\\.(?:/|$))[A-Za-z0-9_.-]{1,64}(?:/(?!\\.{1,2}(?:/|$))(?!(?:[Cc][Oo][Nn]|[Pp][Rr][Nn]|[Aa][Uu][Xx]|[Nn][Uu][Ll]|[Cc][Oo][Mm][1-9]|[Ll][Pp][Tt][1-9])(?:\\.|/|$))(?![A-Za-z0-9_.-]*\\.(?:/|$))[A-Za-z0-9_.-]{1,64})*(?![\\s\\S])"},"mime":{"type":"string","minLength":3,"maxLength":128,"pattern":"^[a-z0-9][a-z0-9._+-]*/[a-z0-9][a-z0-9._+-]*(?![\\s\\S])"},"annotations":{"type":"object","maxProperties":32,"propertyNames":{"type":"string","minLength":1,"maxLength":128,"pattern":"^[A-Za-z0-9._/-]+(?![\\s\\S])"},"additionalProperties":{"type":"string","maxLength":4096,"pattern":"^[^\\u0000-\\u001f\\u007f-\\u009f]*(?![\\s\\S])"}},"layer":{"type":"object","additionalProperties":false,"required":["path","source","role","mediaType"],"properties":{"path":{"$ref":"#/$defs/path","not":{"const":"package/build-inputs.json"}},"source":{"$ref":"#/$defs/path"},"role":{"enum":["component","capsule-manifest","contracts","wit-lock","renderer","asset"]},"mediaType":{"$ref":"#/$defs/mime"}},"allOf":[{"if":{"properties":{"role":{"const":"component"}},"required":["role"]},"then":{"properties":{"mediaType":{"const":"application/wasm"}}}},{"if":{"properties":{"role":{"const":"capsule-manifest"}},"required":["role"]},"then":{"properties":{"mediaType":{"const":"application/vnd.latent.capsule.manifest.v1+json"}}}},{"if":{"properties":{"role":{"const":"contracts"}},"required":["role"]},"then":{"properties":{"mediaType":{"const":"application/vnd.latent.contracts.v1+json"}}}},{"if":{"properties":{"role":{"const":"wit-lock"}},"required":["role"]},"then":{"properties":{"mediaType":{"const":"application/vnd.latent.wit-lock.v1+json"}}}},{"if":{"properties":{"role":{"const":"renderer"}},"required":["role"]},"then":{"properties":{"mediaType":{"enum":["application/wasm","text/javascript"]}}}}]}},"allOf":[{"if":{"properties":{"kind":{"const":"capsule"}},"required":["kind"]},"then":{"properties":{"layers":{"items":{"properties":{"role":{"enum":["component","capsule-manifest","contracts","wit-lock","asset"]}}},"allOf":[{"contains":{"properties":{"role":{"const":"component"}},"required":["role"]},"minContains":1,"maxContains":1},{"contains":{"properties":{"role":{"const":"capsule-manifest"}},"required":["role"]},"minContains":1,"maxContains":1},{"contains":{"properties":{"role":{"const":"contracts"}},"required":["role"]},"minContains":1,"maxContains":1},{"contains":{"properties":{"role":{"const":"wit-lock"}},"required":["role"]},"minContains":1,"maxContains":1}]}}}},{"if":{"properties":{"kind":{"const":"browser-assets"}},"required":["kind"]},"then":{"properties":{"layers":{"items":{"properties":{"role":{"enum":["asset"]}}}}}}},{"if":{"properties":{"kind":{"const":"ssr-package"}},"required":["kind"]},"then":{"properties":{"layers":{"items":{"properties":{"role":{"enum":["renderer","asset"]}}},"allOf":[{"contains":{"properties":{"role":{"const":"renderer"}},"required":["role"]},"minContains":1,"maxContains":1}]}}}}],"$comment":"Recipe only: source paths select files beneath a separately supplied root. The packaging codec additionally checks UTF-8/document/work limits, duplicate and case/prefix-colliding logical paths, reserved build-inputs path, entrypoint associations, regular files/no-follow traversal, content limits and capsule semantics. One of 256 package layers is reserved for the observed-input receipt. Validation confers no trust or admission."}
